sentence_id,review_id,review,word_count
146.27.4,146.27,food recommendation good come next vacation saigon,7
147.1.1,147.1,visit want enjoy local vietnamese cuisine,6
147.1.2,147.1,staff speaks minimal english description english menu may fully accurate,10
147.1.3,147.1,bring vietnamese friend along,4
147.2.1,147.2,good restaurant family business cozy place delicious food,8
147.3.1,147.3,good food acceptable price service okay,6
147.4.1,147.4,good pork rib,3
147.4.2,147.4,good get together place friend,5
147.5.1,147.5,frequently drink restaurant,3
147.5.2,147.5,many thanks service,3
147.6.1,147.6,good food good menu good service,6
147.6.2,147.6,great atmosphere plenty space,4
147.6.3,147.6,nice relaxing place celebration,4
147.7.1,147.7,new favourite nhu place town atmosphere food service point,9
147.8.1,147.8,serve many dish food prety good,6
147.9.1,147.9,old space menu good many food choose,7
147.14.1,147.14,traditional food good location purpose,5
147.18.1,147.18,low serving crowded,3
147.19.1,147.19,lovely atmosphere delicious food,4
147.2.2,147.2,good food good pork rib good hot pot good fried rice,11
147.24.1,147.24,good family friend party,4
147.33.1,147.33,food good,2
147.51.1,147.51,okay like,2
147.54.1,147.54,delicious eat,2
147.135.1,147.135,authentic vietnamese cuisine,3
148.1.1,148.1,excellent food service went family dinner new year eve,9
148.1.2,148.1,got room kind private area pretty nice,7
148.1.3,148.1,every single dish ordered delicious,5
148.1.4,148.1,highly recommend crab hot pot soup outstanding taste fresh crab naturally sweet great ingredient,14
148.1.5,148.1,expensive restaurant based general pricing,5
148.2.1,148.2,scale restaurant good service,4
148.2.2,148.2,surprisingly place quite good crowd,5
148.2.3,148.2,food well prepared fresh price high side,7
148.2.4,148.2,steam lobster noodle heavenly even much seafood person,8
148.2.5,148.2,definitely worth trying,3
148.3.1,148.3,family often meal special occasion,5
148.3.2,148.3,restaurant well decorated dish good price high side,8
148.3.3,148.3,service compared price charged,4
148.3.4,148.3,restaurant alway fully booked call plan meal,7
148.4.1,148.4,went birthday party,3
148.4.2,148.4,high class restaurant,3
148.4.3,148.4,price high side,3
148.4.4,148.4,good food big small private room,6
148.4.5,148.4,service staff well trained highly recommended,6
148.5.1,148.5,dine almost everytime hcmc,4
148.5.2,148.5,vietnamese friend favourite joint,4
148.5.3,148.5,food good nothing fantastic,4
148.5.4,148.5,quite hong kong japanese food guess nothing wrong,8
148.5.5,148.5,would like praise like chinese food little vietnamese influence sauce different,11
148.5.6,148.5,speak vegetable really much fresher maybe grow better locally e,10
148.5.7,148.5,coriander chilli shallot etc really stand,6
148.5.8,148.5,pricewise little high side,4
148.5.9,148.5,nice restaurant guess pricing alright,5
148.6.1,148.6,luxury restaurant,2
148.6.2,148.6,many asian style food sushi sashimi,6
148.6.3,148.6,chinese vietnamese food,3
148.6.4,148.6,however vietnamese,2
148.6.5,148.6,recommend business meeting customer meeting reunion high class,8
148.6.6,148.6,tried vietnamese sweet sour soup fish stewed whole baby crispy roasted pork three style egg,15
148.6.7,148.6,time visited,2
148.6.8,148.6,pretty good,2
148.6.9,148.6,would recomended people money want try high class vietnamese restaurant saigon,11
148.7.1,148.7,came excellent prawn lobster topped noodle insteam basket dish,9
148.7.2,148.7,tried roasted duck,3
148.7.3,148.7,one better one hcm,4
148.8.1,148.8,good fresh seafood delicious price little high,7
148.9.1,148.9,fancy place dinner,3
148.9.2,148.9,great service mediocre food high price,6
148.1.7,148.1,today went birthday party take place restaurant food good,9
148.1.8,148.1,appetizer dessert taste right,4
148.1.9,148.1,kid love garlic shrimp steam noodle much,7
148.1.10,148.1,thing great think service server could better,7
148.11.1,148.11,expensive restaurant excellent food service,5
148.12.1,148.12,delicious nice private room,4
148.13.1,148.13,food tasty excellent service,4
148.14.1,148.14,rather expensive good quality,4
148.14.2,148.14,especially stone fish,3
148.15.1,148.15,dear first confirm restaurant get good chef main dish ,9
148.15.2,148.15,reason give  star ,3
148.15.3,148.15,price high comparing service,4
148.15.4,148.15,waiter waitress well manager smiling friendly,6
148.15.5,148.15,worked  star service year ago professional,6
148.15.6,148.15,secondly soup made like joke expensive chinese cuisine,8
148.15.7,148.15,ordered  soup thick corn starch,5
148.15.8,148.15,worked kitchen quite sure soup differed extra ingredient,8
148.15.9,148.15,thanks best regard friend,4
148.16.1,148.16,great food tasty,3
148.18.1,148.18,came meet client,3
148.18.2,148.18,food nice restaurant suitable business purpose,6
148.18.3,148.18,staff helpful,2
148.19.1,148.19,staff attentive,2
148.19.2,148.19,delicious food delicious ingredient,4
148.19.3,148.19,space restaurant look luxurious,4
148.2.6,148.2,pricy seafood good quality quantity,5
148.2.7,148.2,shoyld carefully check dish portion enough,6
148.21.1,148.21,food delicious,2
148.23.1,148.23,high end price level seafood restaurant,6
148.25.1,148.25,delicious food nice atmosphere,4
148.26.1,148.26,good place bring young kid enjoy family moment,8
148.27.1,148.27,delicious food nice place,4
148.27.2,148.27,impressive crab hot pot,4
148.28.1,148.28,seafood fan bit steak top drawer,6
148.29.1,148.29,delicious seafood convenience address pas,5
148.3.5,148.3,wonderful restaurant good food delightful staff,6
148.31.1,148.31,luxury restaurant best food service town,6
148.32.1,148.32,good selection sake red white wine great service,8
148.34.1,148.34,good service,2
148.35.1,148.35,great mix chinese japanese shusi,5
148.35.2,148.35,value money,2
148.36.1,148.36,good serving staff,3
148.37.1,148.37,good food price high,4
148.38.1,148.38,fancy astonishing large menu,4
148.4.6,148.4,nice food drink kinda expensive local,6
148.42.1,148.42,fresh sea food wonderful taste,5
148.44.1,148.44,great restaurant delicious crab soup,5
148.45.1,148.45,beefsteak dried rice excellent,4
148.46.1,148.46,food great plating live,4
148.47.1,148.47,simple food good,3
148.49.1,148.49,good service good dish,4
148.5.10,148.5,good place meal,3
148.51.1,148.51,good place good food service,5
148.52.1,148.52,food good fat,3
148.53.1,148.53,luxury restaurant good food,4
148.54.1,148.54,nice place good food,4
148.55.1,148.55,specialize vietnamese style seafood,4
148.57.1,148.57,good place delicious food,4
148.63.1,148.63,good place meal,3
148.66.1,148.66,nice anh delicious,3
148.67.1,148.67,bad service expensive,3
148.7.4,148.7,quite expensive restaurant,3
148.8.2,148.8,luxury delicious,2
148.105.1,148.105,eveythig ok,2
148.109.1,148.109,thai style japanese style chinese style various country cuisine please taste vietnam style,13
148.109.2,148.109,prepared spend least ,3
148.109.3,148.109, million dong  yen per person,5
148.109.4,148.109,food drink without alcohol,4
148.109.5,148.109,correspondence staff pleasant,3
148.109.6,148.109,feel well educated koshi,4
148.114.1,148.114,staff friendly,2
148.114.2,148.114,food delicious,2
148.114.3,148.114,place good atmosphere,3
148.114.4,148.114,ate pigeon meat first time life,6
148.114.5,148.114,taste like bit greasy chicken,5
148.121.1,148.121,fantastic kitchen vietnamese top japanese cuisine also good service outstanding european want excellent vietnamese food sophisticated atmosphere reasonable price come right place incidentally invited vietnamese family speaks term quality,29
149.1.1,149.1,delicious food good service,4
149.2.1,149.2,good food majority food vietnamese food seafood great well restaurant long time already,13
149.2.2,149.2,definitely go back try food,5
149.3.1,149.3,bad deceptive restaurant asked price order,6
149.3.2,149.3,ask much crab  kg   vnd expensive order ask much roast shrimp  kg   vnd order half kg ask much phoenix screw  kg   vnd asked much snail picture waiter said half kilogram,30
149.3.3,149.3,ordered half kilogram result bill paid phoenix snail changed ,9
149.3.4,149.3, million vnd,2
149.3.5,149.3,half kilogram   vnd ask waiter waiter also said ask price,10
149.3.6,149.3,really bad restaurant wont go anymore recommended,7
149.4.1,149.4,good food price cheap service acceptable,6
149.5.1,149.5,good food especially sea food,5
149.6.1,149.6,good location food great,4
149.9.1,149.9,good food service,3
149.32.1,149.32,nice day,2
149.71.1,149.71,seafood restaurant lively late,4
149.71.2,149.71,lot water tank choose dish,5
149.71.3,149.71,first time ate mantis shrimp  cm long delicious,8
149.71.4,149.71,price unknown entertainment,3
149.71.5,149.71,entered private room accompanied companion made mushy could eat shrimp easily,11
149.71.6,149.71,restaurant look cheap,3
149.74.1,149.74,restaurant hosted local friend nice meal,6
149.88.1,149.88,cantonese cuisine reasonable price communicate chinese,6
149.133.1,149.133,typical vietnamese beer house mid priced clean fast,8
150.1.1,150.1,delicious fresh seafood friendly staff one english speaking staff,9
150.1.2,150.1,crab  per kilo clam range  per kilo shrimp  per kilo expect spend  per person minimum,15
150.2.1,150.2,fresh seafood cook right,4
150.2.2,150.2,cooked bland,2
150.2.3,150.2,pretty dissapointing considering pricey ingridients,5
150.3.1,150.3,great place come group people,5
150.3.2,150.3,open area ton room fresh seafood great service,8
150.3.3,150.3,little pricey side recommended,4
150.4.1,150.4,kind live seafood choose allover world,6
150.4.2,150.4,price look high includes cooking service excellent,7
150.5.1,150.5,fresh seafood cook directly caught aquarium,6
150.5.2,150.5,enjoyed sashimi style hot pot style fish time,8
150.5.3,150.5,abalone delicious unique soy base source,6
150.6.1,150.6,although enjoyable expensive good value used,6
150.7.1,150.7,em thi good food superb highly recommend,7
150.8.1,150.8,quite old decoration,3
150.9.1,150.9,average local seafood,3
150.1.3,150.1,food good affordable,3
150.11.1,150.11,order fantastic,2
150.12.1,150.12,m  pax,2
150.13.1,150.13,felt place little expensive got,5
150.13.2,150.13,might ordered,2
150.14.1,150.14,excellent sea food many variety,5
150.15.1,150.15,sea food fresh,3
150.16.1,150.16,big space,2
150.16.2,150.16,service okay,2
150.17.1,150.17,really nice street restaurant beer seafood,6
150.18.1,150.18,delicious however quite expensive,4
150.2.4,150.2,high price seafood restaurant,4
150.2.5,150.2,good men hangout,3
150.21.1,150.21,fresh sea food price quite hight local,7
150.22.1,150.22,fresh seafood nice place dinner,5
150.24.1,150.24,good price seafood fresh,4
150.26.1,150.26,ordinary seafood restaurant,3
150.27.1,150.27,free charge handed wine,4
150.3.4,150.3,nice fresh sea food,4
150.31.1,150.31,fine expensive,2
150.32.1,150.32,high quality food,3
150.37.1,150.37,relax weekend,2
150.48.1,150.48,fresh fresh fresh,3
150.52.1,150.52,good fooo good time,4
150.65.1,150.65,king crab absolutely tasteless king crab meat bland garlic sauce dish neither taste even local said tasteless ,17
150.65.2,150.65, million dong kg price much different korea waste money,9
150.89.1,150.89,nice local location super fresh seafood reasonable price,8
150.98.1,150.98,local seafood restaurant somewhat expensive local good freshness taste,9
150.103.1,150.103,seafood fresh delicious need brought local clerk speak english,9
150.115.1,150.115,also private room private room airconditioned quiet,7
150.115.2,150.115,dedicated room clerk call run drink frequently clear plate shrimp shell eating table always clean,15
150.115.3,150.115,choose favorite cooking method fish tank lower floor,8
150.115.4,150.115,dish delicious,2
150.117.1,150.117,food came late order delayed,5
150.124.1,150.124,delicious many new thing,4
150.149.1,150.149,delicious fresh,2
151.1.1,151.1,pleasant dining experience palate eye,5
151.1.2,151.1,price keeping restaurant style food presentation quality,7
151.1.3,151.1,perfect higherend dining experience entertain visitor without spending exhorbitant amount,10
151.1.4,151.1,note cost estimate per person three people shared  dish,9
151.1.5,151.1,specialize vietnamese crepe variety savory filling mushroom vegetarian option eaten generous amount fresh green herb ingredient fresh spring roll tantalizing array possibility platter fresh green herb vegetable rice vermicelli rice paper choice meat fill table meat fish soup salad,39
151.1.6,151.1,fried rice stirfried green seafood dish also available,8
151.1.7,151.1,fresh juice variety combination also feature,6
151.1.8,151.1,presentation eyecatching flavor wellbalanced,4
151.1.9,151.1,green herb clean fresh see photo green herb storage,9
151.1.10,151.1,restaurant renovated redecorated seating upstairs significantly space see first walk,10
151.1.11,151.1,staff prompt friendly attentive patient,5
151.1.12,151.1,shout security watch bike efficient careful attentive,7
151.1.13,151.1,noticed dropped something realize picked also took initiative request small bag replace paper bag survived rain,16
151.1.14,151.1,salad serving size smaller looked photo appetizer appropriate,8
151.2.1,151.2,excellent place foreigner try vietnamese food time great vietnamese restaurant local try,12
151.2.2,151.2,service amazing quick friendly welcoming,5
151.2.3,151.2,food taste great vegetable come fresh,6
151.2.4,151.2,also dipping sauce tasty,4
151.2.5,151.2,recommended bnh xo bnh kht b l lp,8
151.3.1,151.3,good food good variety clean ok value service however okay better proper trained staff,14
151.4.1,151.4,enjoy vietnamese food delicious lot fresh vegetable,7
151.5.1,151.5,good location wide choice food good,6
151.5.2,151.5,overall experience good business meeting,5
151.6.1,151.6,great vietnamese cousin recommending,4
151.7.1,151.7,absolutely loved restaurant,3
151.7.2,151.7,price better restaurant nearby food delicious,6
151.7.3,151.7,make restaurant stand others one air conditioned environment clean staff friendly helpful even speak english,15
151.7.4,151.7,plus also dish others neighbourhood offer,6
151.7.5,151.7,wished open sooner day also go breakfast,7
151.8.1,151.8,exactly banh xeo love friendly staff  service,7
151.9.1,151.9,restuarant many time,3
151.9.2,151.9,always crowded lunch time,4
151.9.3,151.9,must love wrap raw veggie vietnamese cuisine enjoy dining,9
151.9.4,151.9,food good price higher side,5
151.9.5,151.9,love dessert since sweet like place,6
151.1.15,151.1,food good lot veggie roll,5
151.1.16,151.1,everything came table option roll rice paper,7
151.1.17,151.1,che okay thai lau pretty good,6
151.1.18,151.1,restaurant warm,2
151.11.1,151.11,food great,2
151.11.2,151.11,service great,2
151.11.3,151.11,traditional food love,3
151.11.4,151.11,family  total came  million dong,5
151.11.5,151.11,pricey good,2
151.12.1,151.12,customer service bad,3
151.12.2,151.12,waiter waitress standing counter,4
151.12.3,151.12,ordered beer  time,3
151.12.4,151.12,finally went counter tell,4
151.12.5,151.12,management responsible improve train staff,5
151.13.1,151.13,good food right,3
151.13.2,151.13,price reasonable,2
151.13.3,151.13,seat availability may issue holiday weekend,6
151.13.4,151.13,defs come back dish,4
151.14.1,151.14,price reasonable,2
151.14.2,151.14,food quite good term quantity quality,6
151.14.3,151.14,five people paid around  vnd per person,7
151.14.4,151.14,healthy lot vegetable,3
151.14.5,151.14,general happy visit,3
151.15.1,151.15,place excellent enough space accommodate large party people,8
151.15.2,151.15,beautiful atmosphere food option plentiful,5
151.16.1,151.16,excellent food service restaurant nice clean,6
151.16.2,151.16,menu offer great selection everyone family,6
151.16.3,151.16,third visit two week,4
151.16.4,151.16,highly recommended restaurant,3
151.17.1,151.17,customer service horrible employee rude happy eating,7
151.18.1,151.18,everything good local restaurant,4
151.18.2,151.18,however visit place holiday period would challenging patience waiting queue,10
151.19.1,151.19,nice vietnamese restaurant good selection vietnamese local delight good clean environment,11
151.19.2,151.19,definitely go,2
151.2.6,151.2,really enjoyed food service,4
151.2.7,151.2,great spot come big group,5
151.21.1,151.21,awsome vietnamese authentic dish,4
151.22.1,151.22,misunderstanding part,2
151.22.2,151.22,place great food service outstanding,5
151.23.1,151.23,great vietnamese cuisine,3
151.23.2,151.23,found famous vietnam food,4
151.24.1,151.24,branch located downtown,3
151.24.2,151.24,easy reach,2
151.24.3,151.24,reservation recommended,2
151.24.4,151.24,outdoor seat top floor,4
151.24.5,151.24,good place meal foreign friend,5
151.25.1,151.25,local restaurant good local food inexpensive touristy restaurant,8
151.26.1,151.26,spent three time enjoy food nice place nice food however need improve little service staff friendly,16
151.27.1,151.27,tasty food great service,4
151.28.1,151.28,taste fragrance grilled pork noodle,5
151.29.1,151.29,beautiful interior complement fantastic food upscale local stuff reasonable price,10
151.29.2,151.29,also unique menu item like durian spring roll ill back try,11
151.3.2,151.3,terrible customer service waitress get order right blamed u,9
151.3.3,151.3,food bad,2
151.3.4,151.3,recommend restaurant,2
151.31.1,151.31,service good,2
151.31.2,151.31,stomach okay,2
151.32.1,151.32,place getting bigger,3
151.32.2,151.32,compy last time,3
151.32.3,151.32,food still great,3
151.32.4,151.32,big serving though need increase bit prize,7
151.33.1,151.33,eaten twice really like,4
151.33.2,151.33,food decent tasty price also affordable,6
151.33.3,151.33,place favorable destination tourist local vietnamese,6
151.33.4,151.33,however charged k vn  cent parking quite like,8
151.33.5,151.33,general good place trying southern vietnamese dish,7
151.34.1,151.34,great vietnamese local food,4
151.35.1,151.35,nice clean place vietnamese cuisine price may higher,8
151.35.2,151.35,food tasty especially viet fried roll,6
151.36.1,151.36,food served small portion,4
151.37.1,151.37,nice neighborhood restaurant find good vietnamese cuisine affordable price nice environnement caring staff able speak english,16
151.37.2,151.37,furthermore english menu picture well,5
151.38.1,151.38,pretty restaurant amazing local dish rich taste,7
151.38.2,151.38,get kind spring roll fried rice lotus leaf,8
151.38.3,151.38,loved lot local almost westerner rather seems like secret tip enjoy,11
151.39.1,151.39,great family place excellent food,5
151.39.2,151.39,soup especially good staff work hard make sue enjoy meal,10
151.39.3,151.39,place go want wine meal,5
151.4.2,151.4,local restaurant good cost performance le usd  classy one ambience food good server nice,14
151.41.1,151.41,food good fresh herb vegetable make distinguishable meal,8
151.41.2,151.41,staff nice attentive,3
151.42.1,151.42,one authentic vietnamese food tasted hcmc,6
151.42.2,151.42,advised book table visiting place popular,6
151.43.1,151.43,seated second floor wonderful,4
151.43.2,151.43,food terrific,2
151.43.3,151.43,english speaking waiter,3
151.44.1,151.44,local cuisine try,3
151.44.2,151.44,price food slight high side,5
151.44.3,151.44,serve self wrap roll single meal hotpot,7
151.45.1,151.45,im waiting friend come,4
151.45.2,151.45,ordered water bottle brought super dirty stick layer dirt,9
151.47.1,151.47,new replacement ngon restaurant,4
151.47.2,151.47,variety food,2
151.47.3,151.47,worth try,2
151.48.1,151.48,delicious spring roll,3
151.48.2,151.48,nem nng bit le tasty compare spring roll,8
151.49.1,151.49,fresh goood goood food prepared specially u,7
151.5.3,151.5,nice vietnamese food nice atmosphere,5
151.5.4,151.5,great nem nuong,3
151.51.1,151.51,delicious traditional food must try visit vietnam,7
151.53.1,151.53,food good restaurant clean,4
151.54.1,151.54,good restaurant vietnamese traditional dish reasonable price,7
151.55.1,151.55,traditional vietnamese food,3
151.55.2,151.55,lot roll,2
151.55.3,151.55,expensive amazingly tasty,3
151.56.1,151.56,great food good atmosphere,4
151.57.1,151.57,bland food,2
151.57.2,151.57,hard get well,3
151.59.1,151.59,delicious nice attitude good price,5
151.6.2,151.6,delicious fresh clean,3
151.6.3,151.6,many food fordiner awa lunch,5
151.61.1,151.61,great local food,3
151.62.1,151.62,loved steak,2
151.63.1,151.63,good food good service warming decoration reasonable price many dish menu easy selection,13
151.64.1,151.64,tasty vietnamese food,3
151.66.1,151.66,price okay food quite unique taste experienced,7
151.67.1,151.67,food point,2
151.69.1,151.69,nice place quality vietnames food,5
151.69.2,151.69,good service,2
151.7.6,151.7,great nice deluxe,3
151.71.1,151.71,restaurant regular vietnamese ground floor house eating place good food bit pricy,12
151.72.1,151.72,good vietnamese food good price mil people lunch,8
151.73.1,151.73,nice modern place price little bit higher regular street local place,11
151.73.2,151.73,worth though,2
151.74.1,151.74,small noise rate  star,4
151.74.2,151.74,food delicious,2
151.75.1,151.75,great place fresh eats,4
151.76.1,151.76,good service decent food,4
151.77.1,151.77,loved food,2
151.78.1,151.78,good vietnam food,3
151.79.1,151.79,im regular,2
151.79.2,151.79,garlic rice steak best,4
151.8.2,151.8,bad service angry bad behavior waiter,6
151.81.1,151.81,food okay good service,4
151.82.1,151.82,great hot pot,3
151.83.1,151.83,food great,2
151.87.1,151.87,great food great service,4
151.88.1,151.88,delicous anh beautiful food,4
151.9.6,151.9,good food reasonable price,4
151.93.1,151.93,nice place nice drink,4
151.105.1,151.105,copy version hoang ty,4
151.116.1,151.116,delicious food,2
151.119.1,151.119,nice food,2
151.125.1,151.125,downtown ho chi minh city nh hng ngon famous among foreigner expensive local go,14
151.125.2,151.125,restaurant loved local foreigner almost hard find ben thanh market take tran hung dao road,15
151.125.3,151.125,looking tourist street right pas go straight  minute alley left,10
151.125.4,151.125,price affordable vietnamese food diverse,5
151.125.5,151.125,banh xeo banh kot buntitneung various type fried rice lot beef shabushabu meat spring roll etc,16
151.125.6,151.125,personally love ability divide bn tht nng like,8
151.125.7,151.125,however always lot customer go order food come quickly several people seat reservation basic food reservation essential,17
151.131.1,151.131,vietnamese restaurant,2
151.131.2,151.131,food fresh delicious,3
151.131.3,151.131,downside englishspeaking staff staff helped u order active body language inconvenience,11
151.131.4,151.131,restaurant lively atmosphere visited many people,6
151.131.5,151.131,recommend visit least,3
152.1.1,152.1,service good bad,3
152.1.2,152.1,obvious feel comfortable foreigner coming restaurant,6
152.1.3,152.1,bit awkward unless go way put ease sometimes impossible,9
152.1.4,152.1,hotel close ill probably go time find another restaurant,9
152.1.5,152.1,food good like many vit place,6
152.1.6,152.1,aeon mall nearby offering option,5
152.2.1,152.2,good food delicious,3
152.3.1,152.3,nice place go local food seafood,6
152.3.2,152.3,served exotic food well,4
152.6.1,152.6,expensive price,2
152.8.1,152.8,nice warm good food,4
152.1.7,152.1,good place unwind,3
152.11.1,152.11,expensive good service,3
152.12.1,152.12,good place food beer,4
152.13.1,152.13,great choice area,3
152.15.1,152.15,good food service,3
152.82.1,152.82,ordinary vietnamese food nothing special ktv hall lobby look lively,10
152.9.1,152.9,plate fried noodle beef cost   vnd,6
152.103.1,152.103,bad taste salty heavy,4
152.12.2,152.12,inexpensive friendly service,3
152.143.1,152.143,friendly service attitude,3
153.1.1,153.1,good environment wine,3
153.1.2,153.1,food excellent,2
153.2.1,153.2,vn traditional dish reasonable price,5
153.2.2,153.2,recommend private room business meeting,5
153.3.1,153.3,open day covid lockdown,4
153.3.2,153.3,nice food good service,4
153.5.1,153.5,nice food litte expensive special dish crab hot pot,9
153.6.1,153.6,fresh food good service,4
153.1.3,153.1,great place business,3
153.11.1,153.11,old dirty restaurant,3
153.18.1,153.18,good good good,3
154.1.1,154.1,went restaurant ordered caramelized tofu mushroom clay pot,8
154.1.2,154.1,came fast,2
154.1.3,154.1,pot burning hot food cold,5
154.1.4,154.1,clearly microwaved,2
154.1.5,154.1,besides salty came  piece tofu,5
154.1.7,154.1,recommend restaurant,2
154.2.1,154.2,pretty decent veggie restaurant,4
154.2.2,154.2,standard dropped would never bother eat,6
154.2.3,154.2,smoothy made unripe fruit noodle based dish served glowing red artificial tomato sauce,13
154.3.1,154.3,disappointed staff,2
154.3.2,154.3,requested add plate rice staff gave one big bowl requested give smaller portion refused,14
154.3.3,154.3,food also nothing special opinion,5
154.3.4,154.3,going eat,2
154.4.1,154.4,regret find even living nearby one year,7
154.4.2,154.4,luckily searching restaurant dinner saw,5
154.4.3,154.4,ex vegetarian felt good seeing,5
154.4.4,154.4,going inside saw many vietnamese people coming eat vegetarian food,10
154.4.5,154.4,thinking vietnamese like anything without meat,6
154.4.6,154.4,hardly find place seat peak hour,6
154.4.7,154.4,recommend date romantic dinner,4
154.4.8,154.4,anyway food awesome reasonable,4
154.4.9,154.4,surprised quick service though much crowd,6
154.4.10,154.4,nothing wrong item served wrong bill charged happens usually crowded place,11
154.4.11,154.4,many variety vegetarian dish available,5
154.4.12,154.4,would love visit,3
154.5.1,154.5,bad service poorest meal,4
154.5.2,154.5,make order single wait  minute get dish cold rice small bowl soup,12
154.5.3,154.5,wait  minute main dish,4
154.6.1,154.6,friendly food awesome,3
154.7.1,154.7,however customer need aware cookware use made cheap aluminum alloy contains lot lead,13
154.7.2,154.7,tell aluminum utensil develop black coating picture,7
154.7.3,154.7,lead aluminum bad brain,4
