sentence_id,review_id,review,word_count
97.4.7,97.4,mean price par expect u ridiculous considering subpar quality,9
97.4.8,97.4,let get actual food,4
97.4.9,97.4,jasmine tea disgustingly watered taste like hot boiled water instead tea,11
97.4.10,97.4,even get started dim sum,5
97.4.11,97.4,ordered har kau skin thick flavorless might well even,9
97.4.12,97.4,fried noodle seafood cold dripping oil,6
97.4.13,97.4,asked server cold completely ignored u add insult injury,9
97.4.14,97.4,save money skip forgettable place altogether,6
97.4.15,97.4,looking authentic delicious dim sum look elsewhere,7
97.4.16,97.4,trust thank later,3
97.5.1,97.5,delicious chinese food,3
97.5.2,97.5,nice place business lunch,4
97.6.1,97.6,restaurant clean clear,3
97.6.2,97.6,dish tasty especially roasted duck,5
97.6.3,97.6,family friend love place,4
97.6.4,97.6,always choose place special event,5
97.7.1,97.7,one mustgoto place whenever town,5
97.7.2,97.7,food amazing,2
97.7.3,97.7,favourite steamed rice roll fried xo sauce,7
97.7.4,97.7,say like eating hong kong,5
97.7.5,97.7,service impeccable,2
97.8.1,97.8,chinese restaurant located near airport,5
97.8.2,97.8,food okay train staff well,5
97.8.3,97.8,ask food take long time hair food staff take note go away apologize action taken,15
97.8.4,97.8,ruining dining experience,3
97.9.1,97.9,good dimsum chinese food restaurant level  tan son nhat hotel,10
97.9.2,97.9,happy food service happy staff recommend order,7
97.9.3,97.9,price accepted worth,3
97.1.5,97.1,order long bad service,4
97.1.6,97.1,want test patient eq great place,6
97.11.1,97.11,dimsum lunch dinner,3
97.11.2,97.11,dish oil fat,3
97.11.3,97.11,good group people family,4
97.12.1,97.12,delicious food good service,4
97.13.1,97.13,standard chinese restaurant,3
97.13.2,97.13,food good nothing extremely good impressive,6
97.14.1,97.14,nice restaurant five star tan son nhat hotel well know located,11
97.14.2,97.14,good atmosphere drink food delicious,5
97.15.1,97.15,food good enough serving little bit distraction,7
97.16.1,97.16,china restaurant lot delicious china food special one dimsum,9
97.17.1,97.17,good service good venue,4
97.17.2,97.17,parking area convienience,3
97.17.3,97.17,come time nd floor  hoang van thu mentioned point however third time found price small vegetable dish shiitake asparagus high ,20
97.17.4,97.17,vnd v price half pecking duck  dish ,7
97.17.5,97.17,regretted taking photo vegetable dish,5
97.17.6,97.17,worth enjoying highly recommend order shiitake stirred asparagus,8
97.17.7,97.17,others good comment,3
97.18.1,97.18,came across dim tu tac lunch,6
97.18.2,97.18,steamed prawn dumpling steamed pork prawn dumpling rice roll shrimp crispy rice fresh tasty name,15
97.18.3,97.18,stir fried vegetable preserved taro curd sauce overpriced,8
97.18.4,97.18,staff friendly professional,3
97.18.5,97.18,noted service charge included,4
97.19.1,97.19,diversify dish menu,3
97.19.2,97.19,good taste easpecially tea must try visit,7
97.19.3,97.19,good service clean restaurant,4
97.19.4,97.19,good place meal family large group,6
97.19.5,97.19,allow reserve also deliver door door,6
97.19.6,97.19,dim tu tac tan son nhat big safe car park inside compound,12
97.2.5,97.2,love place,2
97.21.1,97.21,excellent service lovely delicious food,5
97.22.1,97.22,food good price bit expensive,5
97.23.1,97.23,great place enjoy dim sum,5
97.24.1,97.24,great food good service decently priced,6
97.24.2,97.24,keep returning,2
97.24.3,97.24,tender duck meat generous sauce portion,6
97.24.4,97.24,patient understanding staff,3
97.24.5,97.24,note price bother going hoang yen vietnamese cuisine,8
97.24.6,97.24,   awful tasting dish bad service even charged u smth order,10
97.26.1,97.26,good food good price good service,6
97.27.1,97.27,bit pricey amazing food,4
97.27.2,97.27,everything expectation service great,4
97.27.3,97.27, mil got half duck noodle vegetable  soup hot tea free dessert,11
97.28.1,97.28,everything good,2
97.28.2,97.28,food tasty deserved different part right moment temperature table,9
97.28.3,97.28,place look clean bit luxurious,5
97.29.1,97.29,nice dim sum place hcm,5
97.3.7,97.3,good freshly made dimsum dish,5
97.3.8,97.3,regular guest time,3
97.31.1,97.31,tasty dim sum good service reasonable price,7
97.31.2,97.31,place well organized table couple well family large group,9
97.34.1,97.34,dimsum dish reasonably priced service excellent,6
97.34.2,97.34,beware price gst inclusive,4
97.35.1,97.35,good place family,3
97.36.1,97.36,location food quite suitable every one,6
97.37.1,97.37,one best dimsum chinese cuisine town,6
97.37.2,97.37,great location hospitable staff spacious car parking,7
97.38.1,97.38,food excellence,2
97.38.2,97.38,dimsum good,2
97.39.1,97.39,nice chinese restaurant,3
97.39.2,97.39,dimsum better din tai fung restaurant,6
97.39.3,97.39,must try dimsum visit restaurant,5
97.4.17,97.4,one best chinese restaurant ho chi minh city vietnam,9
97.4.18,97.4,price quite affordable,3
97.41.1,97.41,dim tu tac good chinese style restaurant located nd floor tan son nhat airport hotel,15
97.42.1,97.42,good dim sum poor service,5
97.43.1,97.43,food excellently delicious,3
97.43.2,97.43,staff quick always ready assist,5
97.44.1,97.44,inside tan son nhat hotel free parking car,8
97.44.2,97.44,hong kong style food,4
97.45.1,97.45,good chinese restaurant,3
97.46.1,97.46,spectacular meal awesome first class restaurant,6
97.46.2,97.46,come back,2
97.48.1,97.48,good place dimsum chinese hong kong style,7
97.49.1,97.49,satisfy foodgood dimsum good service,5
97.5.3,97.5,good place chinese food service good,6
97.51.1,97.51,serve delectable cantonese dish,4
97.52.1,97.52,good food service okay,4
97.54.1,97.54,good food quite expensive,4
97.55.1,97.55,overall good service bit slow,5
97.56.1,97.56,good roasted duck thin skin,5
97.57.1,97.57,best cantonese food city,4
97.58.1,97.58,delicious food expensive,3
97.59.1,97.59,good taste try,3
97.6.5,97.6,good food affordable,3
97.61.1,97.61,good food good price,4
97.62.1,97.62,nice food nice place,4
97.65.1,97.65,poor service food foreign,4
97.67.1,97.67,pricey worthy,2
97.68.1,97.68,best dimsum city,3
97.69.1,97.69,good food service,3
97.7.6,97.7,good food service,3
97.71.1,97.71,luxury chinese restaurant,3
97.73.1,97.73,best dimsum,2
97.74.1,97.74,great food service,3
97.75.1,97.75,good food good place,4
97.78.1,97.78,food okay,2
97.79.1,97.79,fresh delicious meal,3
97.8.5,97.8,best china food,3
97.81.1,97.81,chinese food good,3
97.92.1,97.92,ok food chinese,3
97.97.1,97.97,average dimsum restaurant service really compared din tai fung crystal jade palace,12
97.97.2,97.97,however good enough near airport would like quick bite,9
97.99.1,97.99,visited two dim tu tak place ho chi minh district  came branch wanted eat dim sum one last time going airport,21
97.99.2,97.99,second floor inside hotel building panic see sign,8
97.99.3,97.99,service similar dimtuks xiaolongbao taste bit lacking,7
97.99.4,97.99,hagawu delicious,2
97.99.5,97.99,last dessert gave memorable service received branch,7
97.99.6,97.99,dim tu tak seems delicious branch,6
97.99.7,97.99,visit next time,3
97.104.1,97.104,chinese restaurant  minute drive sadian,5
97.104.2,97.104,sure enough worth taking taxi,5
97.104.3,97.104,five people party ordered various snack drink,7
97.104.4,97.104,product like name store everything really good,7
97.104.5,97.104,authentic ingredient fresh ingredient good,5
97.104.6,97.104,everyone ate licked leg,4
97.104.7,97.104,deepest impression free dessert platter end different previous chinese restaurant,10
97.104.8,97.104,favorite lemon ice,3
97.108.1,97.108,quite satisfactory best shrimp dumpling others certain standard disadvantage noisy enjoy morning tea may habit drinking tea,17
97.115.1,97.115,ordering told u dim sum,5
97.115.2,97.115,ordering next guest come eat dim sum,7
97.115.3,97.115,ate saw chinese menu happy hear service staff could speak chinese,11
97.115.4,97.115,food delicious feel bad deceive customer like,7
97.118.1,97.118,everything delicious box beautiful design sense cabin recommended,8
97.138.1,97.138,located near airport,3
97.138.2,97.138,know another dim tu tac store,6
97.138.3,97.138,food delicious service quick staff friendly,6
97.138.4,97.138,besides dim sum mapo tofu fried rice delicious,8
98.1.1,98.1,simple lunch,2
98.1.2,98.1,thought food quite tasty especially pork belly drink yummy,9
98.1.3,98.1,quite number item menu available,5
98.1.4,98.1,possibly due long weekend,4
98.1.5,98.1,price may seem expensive local standard paid close k  main  drink,11
98.2.1,98.2,know food taste nice,4
98.2.2,98.2,bit weird,2
98.2.3,98.2,probably lunch bit dry,4
98.2.4,98.2,service good,2
98.2.5,98.2,price k set,3
98.2.6,98.2,drink k included set,4
98.2.7,98.2,next railroad might see rain passing,6
98.3.1,98.3,[general] like food chain really authentic,6
98.3.2,98.3,server lot local food like pho,6
98.3.3,98.3,[ambiente] store offer  seat ground floor,6
98.3.4,98.3,order directly front office pay afterwards,6
98.3.5,98.3,[pricing] really cheap comparable touristic price,6
98.3.6,98.3,looking cheap diner go,4
98.3.7,98.3,actually much time look alternative place,6
98.3.8,98.3,would could,2
98.4.1,98.4,taste fine expensive,3
98.5.1,98.5,food acceptable price expensive,4
98.5.2,98.5,serve slow,2
98.5.3,98.5,forced order extra option bring income,6
98.5.4,98.5,delivered meal without,3
98.5.5,98.5,collect cost still put bill extra optipns,7
98.5.6,98.5,bad thing put extra charge tax without notice,8
98.5.7,98.5,thing made disappointed staff give bill made doubt staff took higher cost bill show,14
98.5.8,98.5,mean staff stole money guest,5
98.5.9,98.5,think come back  restaurant planet,5
98.6.1,98.6,subway version com tam avoid unless need ac,8
98.6.2,98.6,meat tough soup cold service mediocre,6
98.6.3,98.6,three week asia travel upset stomach eating,7
98.7.1,98.7,food really flavourful service could vigilant,6
98.7.2,98.7,atmosphere decent,2
98.8.1,98.8,good restaurant signature dish com tam traditional food vietnam served rice ripped pork egg vietnamese sausage eat fish sauce fermented vegetable make good special taste flavor eater never forget,29
98.8.2,98.8,price bit higher normal eatery serve dish along street,9
98.9.1,98.9,went randomly,2
98.9.2,98.9,food good,2
98.9.3,98.9,tried one frozen yogurt nice,5
98.9.4,98.9,staff nice even nobody speaks english,6
98.9.5,98.9,old furniture sit,3
98.1.6,98.1,good food delicious,3
98.1.7,98.1,love place,2
98.11.1,98.11,food okay important waiter speaks english,6
98.12.1,98.12,today stopped dinner family,4
98.12.2,98.12,son little girl well wife,5
98.12.3,98.12,wait staff slow receive u odd second customer place,9
98.12.4,98.12,took two waiter take order speak english vietnamese seemed though staff paying attention got order wrong,16
98.12.5,98.12,ordered kid meal noodle pho  drink,6
98.12.6,98.12,flavour mediocre best,3
98.12.7,98.12,worth price,2
98.12.8,98.12,son accidentally spilled soup asked staff napkin,7
98.12.10,98.12,interestingly said could one left table wet one charge extra without telling people first time traveller,16
98.12.11,98.12,sad part odacity include tip bill,6
98.12.12,98.12,ate fast childrens sped would allow left,7
98.12.13,98.12,whole time eye wait staff staring may help kind way know ask bill three time,15
98.12.14,98.12,would absolutely recommend place anyone,5
98.13.1,98.13,food average,2
98.13.2,98.13,expensive small serf egg cold pork chop small,8
98.13.3,98.13,much better option exist broken rice,6
98.13.4,98.13,charge  tax mention anywhere,4
98.14.1,98.14,despite meh service really enjoyed food,6
98.14.2,98.14,big mixed juice bun cha ha noi best pick u bit crowded better book plan go group,17
98.15.1,98.15,dish many choice combination wow overall,6
98.15.2,98.15,want variety great want great tasting authentic com tam greatest,10
98.16.1,98.16,waiter friendly though speak english,5
98.16.2,98.16,food good many crowd pm,5
98.17.1,98.17,rice warm food soup cold smell unfresh,7
98.17.2,98.17,hot tea expensive tiny cup,5
98.18.1,98.18,food nice tasty,3
98.18.2,98.18,upset stomach eating,3
98.18.3,98.18,would avoid place go elsewhere,5
98.19.1,98.19,food okay service terrible especially lunch time understaffed slow,9
98.19.2,98.19,many time wait  min told need order something else,9
98.2.8,98.2,nice meal hear small place near train rail seat geoup ,10
98.21.1,98.21,get ripped including taste,4
98.22.1,98.22,sauce salty,2
98.23.1,98.23,food average,2
98.23.2,98.23,waitress polite nice,3
98.24.1,98.24,food avarage pricey,3
98.24.2,98.24,crowded lunch hour close office,5
98.25.1,98.25,service slow food bad sometimes,5
98.25.2,98.25,time average bit pricy,4
98.26.1,98.26,really great place get healthy well prepared well served meal modest price,12
98.27.1,98.27,located rail path take look train moving fast sometime,9
98.28.1,98.28,price high food quality bad,5
98.29.1,98.29,lunch dinner time,3
98.31.1,98.31,good food rather high price,5
98.32.1,98.32,got order wrong tried charge change correct one,8
98.33.1,98.33,far good,2
98.33.2,98.33,normal standard food,3
98.34.1,98.34,meal ok,2
98.35.1,98.35,ok food slow serving pricey,5
98.36.1,98.36,tasty delicious,2
98.37.1,98.37,good food clean fast service,5
98.38.1,98.38,service good,2
98.39.1,98.39,noodle better broken rice,4
98.4.2,98.4,customer friendly staff,3
98.41.1,98.41,food good ad,3
98.43.1,98.43,good high price,3
98.48.1,98.48,food okay,2
98.49.1,98.49,favorite place,2
98.5.10,98.5,need improvement hygiene,3
98.61.1,98.61,good com tam,3
98.74.1,98.74,next railroad see train passing sometimes,6
98.74.2,98.74,said food set one dish traditional betna food,8
98.74.3,98.74,taste also suit taste korean well,6
98.85.1,98.85,variety dish come one bowl,5
98.85.2,98.85,bad grab bite eat meal,5
98.88.1,98.88,delicious vietnamese delicious foreigner korean friend said expensive,8
98.104.1,98.104,seems gum sweat chain store various kind gum sweat,9
98.104.2,98.104,neat cool,2
98.136.1,98.136,menu easy understand picture,4
98.136.2,98.136,railroad track right next store enjoy meal watching train,9
98.148.1,98.148,mediocre fusion restaurant,3
98.148.2,98.148,staff friendly facility clean food tasty,6
98.153.1,98.153,taste fit japanese,3
102.1.1,102.1,price bit higher outside airport depending time take food ready,10
102.1.2,102.1,today everything went smooth plate full food ready time,9
102.1.3,102.1,fry nicely seasoned,3
102.1.4,102.1,chicken spicy full meat,4
102.1.5,102.1,burger bacon looked like slapped around still tasted good,9
102.1.6,102.1,didnt room tart,3
102.2.1,102.2,eat many time chicken best today eat cashier bed temper never meet meet like,14
102.3.1,102.3,casual okay quick bite airport tam son nhat international arrival,10
102.3.2,102.3,price stretched airport price,4
102.3.3,102.3,seating area left counter,4
102.6.1,102.6,fried chicken shop outside first floor airport fried chicken juicy delicious french fry thick set meal filling,17
102.8.1,102.8,located outside hall first floor airport,6
102.8.2,102.8,sink seating area,3
102.8.3,102.8,fried chicken delicious,3
103.1.2,103.1,mcdonalds vietnam good many option many canada also specialty item,10
103.1.3,103.1,see happy meal toy exact,5
103.1.4,103.1,fried chicken glorious,3
103.2.1,103.2,staff atitude rude,3
103.2.2,103.2,serve food customer following number serve want serve even though meal,11
103.2.3,103.2,waiting long morning even though  customer,6
103.2.4,103.2,food safety control low guess worse south asian macd,9
103.2.5,103.2,visited almost asian country macd never regret,7
103.2.6,103.2,first time,2
103.2.7,103.2,egg many,2
103.2.8,103.2,got diarrhea days,3
103.3.1,103.3,mcdonald country far service tsn domestic airport branch,8
103.3.2,103.3,order delivered incomplete mins,4
103.3.3,103.3,worse chicken delivered mins late inform cooking batch chicken worst manager rude asked utensil chicken newly cooked told give fork knife,21
103.3.4,103.3,short use hand choose completely lost appetite,7
103.4.1,103.4,arrived  pm busy time,4
103.4.2,103.4,staff informed u spicy chicken ordered disappointing took  minute get fried chicken fry also came greasy undercooked,17
103.4.3,103.4,terrible experience group traveler limited time sleep flight,8
103.5.1,103.5,mcdonalds airport,2
103.5.2,103.5,arrived bit early came food kill time,7
103.5.3,103.5,like self service store table already dirty seat,8
103.5.4,103.5,wifi need input personal information like email phone number access ,10
103.5.5,103.5,actually input random information access right away,7
103.6.1,103.6,staff untrained running around like headless chicken,7
103.6.2,103.6,waited order  minute witnessed transferring food item one bag another constantly idea fulfill order competently,15
103.6.3,103.6,saw one staff run front counter mcflurry hand exclaiming whose whilst visibly showing confusion lack awareness understanding even made mcflurry first place,22
103.7.1,103.7,another mcdonalds located inside airport,5
103.7.2,103.7,spacious outside area staff seem confused,6
103.7.3,103.7,busy serving time quick,4
103.7.4,103.7,use app get lot deal promotion,6
103.8.1,103.8,amazing friendly service everything fresh thank,6
103.9.1,103.9,staff bother greet talk ordered,5
103.9.2,103.9,food terribly cold,3
103.9.3,103.9,cannot hold candle macd country,5
103.1.5,103.1,first day nice start day great food little confused currency language amazed different condiment,14
103.11.1,103.11,charged extra adding mayonnaise burger pump mayonaise outside,8
103.11.2,103.11,quite understand logic pricing,4
103.12.1,103.12,delicious fast food feeling hungry,5
103.12.2,103.12,close airport,2
103.12.3,103.12,staff friendly speak english ask need,6
103.13.1,103.13,good friendly staff,3
103.13.2,103.13,quite slow term fastfood,4
103.13.3,103.13,take  min burger egg cheese,5
103.14.1,103.14,waited  minute breakfast served half cooked egg,7
103.15.1,103.15,food staff good,3
103.15.2,103.15,mcfluri oreo nice,3
103.15.3,103.15,air condition good wifi,4
103.16.1,103.16,good location good staff good food except chip good small soft good quality potato,14
103.17.1,103.17,lounge access purchase available pay food drink wifi printing make delay much easier handle foreign country,16
103.18.1,103.18,price affordable friendly staff,4
103.19.1,103.19,easy arrive motorbike car,4
103.19.2,103.19,stay tight line local cut line,6
103.19.3,103.19,personal space boundary different compared culture,6
103.19.4,103.19,check fast,2
103.19.5,103.19,restaurant lot item  pm,4
103.19.6,103.19,item expensive like airport,4
103.2.9,103.2,near domestic terminal one favorite place stop flight,8
103.2.10,103.2,food always prepared fresh order,5
103.2.11,103.2,mean filet fish day,4
103.2.12,103.2,place filet fish sitting around stale old time get,9
103.2.13,103.2,friendly staff pretty fast,4
103.2.14,103.2,dining area inside small seating patio mind outside,8
103.21.1,103.21,good place wait plane,4
103.22.1,103.22,could  star definitely get,4
103.23.1,103.23,aromatic espresso coffee saw mcdonald tn sn nht gastronomic street garden modern town,13
103.23.2,103.23,thought city probably never go sleep,6
103.24.1,103.24,well food normal coca tasted really bad worst problem,9
103.24.2,103.24,mouse running restaurant ran staff professional little sorry one waitress reduction commercial gesture nothing,14
103.24.3,103.24,well come back mcdonals restaurant vietnam,6
103.25.3,103.25,employee speak english,3
103.25.4,103.25,next terminal,2
103.25.5,103.25,mcdonalds little bit hidden need use google want know located ask someone,12
103.25.6,103.25,never overcrowded also mcdonalds small one compared mcdonalds city,9
103.25.7,103.25,recommend food,2
103.25.8,103.25,well made like every mcdonalds vietnam better taste know america europe,11
103.25.9,103.25,also terminal monitor order food computer without saying anything cashier,10
103.26.2,103.26,said open am,3
103.26.3,103.26,waited till am hope catch food flight,7
103.26.4,103.26,open ,1
103.27.1,103.27,open   suitable people arrive airport late,6
103.27.2,103.27,food cheap delicious,3
103.27.3,103.27,howrver fewer choice compare mcdonalds city,6
103.28.1,103.28,hub vietnam southern part demestic air,6
103.29.1,103.29,seven sea entertainment licensed english translation magical girl site manga series,11
103.29.2,103.29,may  official english translation magical girl site volume ,8
103.29.3,103.29,volume  scheduled release september   volume  set january  ,7
103.29.4,103.29,fan translation project keeping japanese chapter release,7
103.3.5,103.3,finally horrific experience danang airport burger king last night could finally good burger  day eating vietnamese food,17
103.3.6,103.3,good price well organized kitchen clean,6
103.31.1,103.31,open   great late flight super early one,7
103.31.2,103.31,coffee nice chicken nugget piping hot,6
103.32.1,103.32,restuarant clean,2
103.32.2,103.32,breakfast sandwich taste exactly like u mcdonald,7
103.32.3,103.32,downside iced coffee,3
103.32.4,103.32,sooo much ice,3
103.32.5,103.32,basically cup ice,3
103.33.1,103.33,conveniently located next airport,4
103.33.2,103.33,accept contactless payment time writing,5
103.33.3,103.33,staff helpful polite,3
103.34.1,103.34,resturaunt bit dirty,3
103.34.2,103.34,typical mcdonald experience,3
103.35.1,103.35,unfriendly unhelpful personal,3
103.35.2,103.35,poor layout actually connected international flight terminal,7
103.35.3,103.35,toilet dirty smelly standard,4
103.36.1,103.36,good quick service,3
103.38.1,103.38,please update hour excited grab food closed despite   claim,9
103.39.1,103.39,basic simple airport,3
103.39.2,103.39,functional bearable,2
103.39.3,103.39,expect typical luxury modern airport,5
103.4.4,103.4,open   suitable people arrive airport late,6
103.4.5,103.4,food cheap delicious,3
103.41.1,103.41,first place eaten arriving ho chi minh city,8
103.41.2,103.41,super fast service excellent food quality,6
103.43.1,103.43,open  hr even covid,4
103.44.1,103.44,good airport international,3
103.44.2,103.44,take taxi right price,4
103.44.3,103.44,food store included,3
103.45.1,103.45,upgrading parking area service,4
103.45.2,103.45,airline please choose cheap one,5
103.45.3,103.45,make wait check  min delay,5
103.46.1,103.46,delicious tiramisu passion pop chiller,5
103.47.1,103.47,clean place good service,4
103.47.2,103.47,little small many people airport,5
103.48.1,103.48,staff friendly professional,3
103.48.2,103.48,confusing upselling making order wrong thing need,7
103.49.1,103.49,wifi guy need make long video call,7
103.5.6,103.5,good eat,2
103.51.1,103.51,superb staff excellent service,4
103.51.2,103.51,addittionally clever handle waste desposal missing american mcdonalds resturants,9
103.52.1,103.52,best chicken sandwich ever better chic fill poppeys hand,9
103.53.1,103.53,free wifi coffee puro gusto coffee shop suck snack ok,10
103.54.1,103.54,nice place good food,4
103.54.2,103.54,minus offer big mac morning,5
103.55.1,103.55,maccy d ho chi minh,5
103.55.3,103.55,wanted taste home,3
103.55.4,103.55,yh fun,2
103.56.1,103.56,good service warm staff great food,6
103.56.2,103.56,child favorite place,3
103.57.1,103.57,tired customer come flight family please help ordering using machine easy,11
103.59.1,103.59,usual mcdonald also easy use screen english work well nice open hours best part,14
103.6.4,103.6,great music bad morning,4
103.61.1,103.61,easy finding airport,3
103.62.1,103.62,wifi free supply charge free good terminal,7
103.63.1,103.63,good customer service accommodate u well,6
103.64.1,103.64,great location convenient grab quick delicious bite flight,8
103.65.1,103.65,near domestic terminal quite convinient little bit crowded,8
103.67.1,103.67,know mcdonalds global chained store,5
103.67.2,103.67,chicken one delicious mcdonalds ive ever,6
103.68.1,103.68,nothing much see,3
103.68.2,103.68,overpriced average pho though,4
103.69.1,103.69,big foreign brand came vietnam couple year ago medium quality voted,11
103.7.5,103.7,great place grad fast meal boarding,6
103.71.1,103.71,visited open,2
103.72.1,103.72,upgrading way,2
103.72.2,103.72,still need improvement handle domestic flight,6
103.73.1,103.73,food beverage awful price unreasonably high,6
103.74.1,103.74,much place sit,3
103.75.1,103.75,vietnam home ph xoi eat local,6
103.76.1,103.76,small nice,2
103.77.1,103.77,food greasy chicken full oil basically inedible,7
103.78.1,103.78,good fast food taste mcdonald usa,6
103.81.1,103.81,good place sit friend,4
103.82.1,103.82,look like domestic terminal better international terminal,7
103.83.1,103.83,fast clean quick meal flight,5
103.84.1,103.84,good place making appointment airport,5
103.85.1,103.85,least know gonna get,4
103.86.1,103.86,good place near airport,4
103.87.1,103.87,place clean,2
103.89.1,103.89,music loud service good,4
103.9.4,103.9,constant reliable,2
103.93.1,103.93,place h open,3
103.94.1,103.94,good place child,3
103.97.1,103.97,fault maccy,2
103.99.1,103.99,lounge upgraded,2
103.1.6,103.1,quick meal flight,3
103.101.1,103.101,good western food,3
103.102.1,103.102,looooooooong queue security gate,4
103.103.1,103.103,good service,2
103.104.1,103.104,old still great,3
103.105.1,103.105,service good,2
103.106.1,103.106,far good,2
103.107.1,103.107,expensive got,2
103.108.1,103.108,tan son nhat airport early morning,6
103.11.3,103.11,delicious hamburger chip,3
103.113.1,103.113,friendly team speck english,4
103.115.1,103.115,marrison thot,2
103.118.1,103.118,service good,2
103.12.4,103.12,fast food,2
103.121.1,103.121,waited long,2
103.124.1,103.124,clean comfortable,2
103.128.1,103.128,love mcdonal,2
103.134.1,103.134,patty cheeseburger,2
103.151.1,103.151,fast cheap,2
106.1.1,106.1,get negative road first although table empty took least  minute staff clear table u seated,15
106.1.2,106.1,secondly salmon sashimi ordered bone see video,7
106.1.3,106.1,although theatrics looked cool sashimi,5
